{
  "env_name": "REPLACE",
  "mode": "backtest",
  "strategy": {
    "ref": "bband_volume_setup",
    "params": {
      "tranche_size_qty": 10,
      "minute_bar_step": 5,
      "bband_period": 20,
      "bband_stddev": 2.0,
      "volume_avg_period": 20,
      "day1_volume_multiplier": 2.0,
      "spike_volume_multiplier": 3.0,
      "spike_price_move_pct": 1.5,
      "surge_volume_multiplier": 2.0,
      "surge_requires_price_below_open": true,
      "surge_min_gap_minutes": 30,
      "tranche_count": 3,
      "hard_stop_pct_below_day1_low": 2.0,
      "max_hold_days": 5
    }
  },
  "venue": { "id": "nasdaq_sim", "account_kind": "paper" },
  "data": {
    "live_source": "venue",
    "historical_source": "synthetic_fixture",
    "instruments": ["MSFT.NASDAQ"],
    "bar_spec": "1-DAY-LAST"
  },
  "risk": {},
  "reporting": { "timezone": "UTC" }
}
