{
  "env_name": "ibkr_paper_template",
  "mode": "paper",
  "strategy": {
    "ref": "toy_buy_and_hold",
    "params": {}
  },
  "venue": {
    "id": "ibkr",
    "account_kind": "paper",
    "gateway_host": "host-gateway",
    "gateway_port_paper": 4002,
    "gateway_port_live": 4001,
    "account_id_env": "IBKR_ACCOUNT_ID",
    "username_env": "IBKR_USERNAME",
    "password_env": "IBKR_PASSWORD"
  },
  "data": {
    "live_source": "ibkr",
    "historical_source": "ibkr_historical",
    "instruments": ["AAPL.NASDAQ"],
    "bar_spec": "1-DAY-LAST",
    "lookback_days": 365
  },
  "risk": {
    "max_position_usd": 10000.0,
    "max_daily_loss_usd": 500.0,
    "price_band_bps": 200,
    "market_hours_only": true
  },
  "reporting": {
    "timezone": "UTC"
  }
}
